00:00.0 Host bridge: Intel Corporation 82Q963/Q965 Memory Controller Hub (rev 02)
	Subsystem: Fujitsu Technology Solutions Device 10b5
	Control: I/O- Mem+ BusMaster+ SpecCycle- MemWINV- VGASnoop- ParErr- Stepping- SERR+ FastB2B- DisINTx-
	Status: Cap+ 66MHz- UDF- FastB2B+ ParErr- DEVSEL=fast >TAbort- <TAbort- <MAbort+ >SERR- <PERR- INTx-
	Latency: 0
	Capabilities: [e0] Vendor Specific Information <?>
	Kernel driver in use: agpgart-intel
	Kernel modules: intel-agp

00:02.0 VGA compatible controller: Intel Corporation 82Q963/Q965 Integrated Graphics Controller (rev 02)
	Subsystem: Fujitsu Technology Solutions Device 10b5
	Control: I/O+ Mem+ BusMaster+ SpecCycle- MemWINV- VGASnoop- ParErr- Stepping- SERR- FastB2B- DisINTx+
	Status: Cap+ 66MHz- UDF- FastB2B+ ParErr- DEVSEL=fast >TAbort- <TAbort- <MAbort- >SERR- <PERR- INTx-
	Latency: 0
	Interrupt: pin A routed to IRQ 25
	Region 0: Memory at d0000000 (32-bit, non-prefetchable) [size=1M]
	Region 2: Memory at c0000000 (64-bit, prefetchable) [size=256M]
	Region 4: I/O ports at 4800 [size=8]
	Capabilities: [90] Message Signalled Interrupts: Mask- 64bit- Queue=0/0 Enable+
		Address: fee0100c  Data: 4191
	Capabilities: [d0] Power Management version 2
		Flags: PMEClk- DSI+ D1- D2- AuxCurrent=0mA PME(D0-,D1-,D2-,D3hot-,D3cold-)
		Status: D0 PME-Enable- DSel=0 DScale=0 PME-
	Kernel driver in use: i915
	Kernel modules: i915

00:02.1 Display controller: Intel Corporation 82Q963/Q965 Integrated Graphics Controller (rev 02)
	Subsystem: Fujitsu Technology Solutions Device 10b5
	Control: I/O- Mem- BusMaster- SpecCycle- MemWINV- VGASnoop- ParErr- Stepping- SERR- FastB2B- DisINTx-
	Status: Cap+ 66MHz- UDF- FastB2B+ ParErr- DEVSEL=fast >TAbort- <TAbort- <MAbort- >SERR- <PERR- INTx-
	Region 0: Memory at 80000000 (32-bit, non-prefetchable) [disabled] [size=1M]
	Capabilities: [d0] Power Management version 2
		Flags: PMEClk- DSI+ D1- D2- AuxCurrent=0mA PME(D0-,D1-,D2-,D3hot-,D3cold-)
		Status: D0 PME-Enable- DSel=0 DScale=0 PME-

00:03.0 Communication controller: Intel Corporation 82Q963/Q965 HECI Controller (rev 02)
	Subsystem: Fujitsu Technology Solutions Device 10b5
	Control: I/O- Mem+ BusMaster+ SpecCycle- MemWINV- VGASnoop- ParErr- Stepping- SERR- FastB2B- DisINTx-
	Status: Cap+ 66MHz- UDF- FastB2B- ParErr- DEVSEL=fast >TAbort- <TAbort- <MAbort- >SERR- <PERR- INTx-
	Latency: 0
	Interrupt: pin A routed to IRQ 11
	Region 0: Memory at d0326000 (64-bit, non-prefetchable) [size=16]
	Capabilities: [50] Power Management version 3
		Flags: PMEClk- DSI- D1- D2- AuxCurrent=0mA PME(D0+,D1-,D2-,D3hot+,D3cold+)
		Status: D0 PME-Enable- DSel=0 DScale=0 PME-
	Capabilities: [8c] Message Signalled Interrupts: Mask- 64bit+ Queue=0/0 Enable-
		Address: 0000000000000000  Data: 0000

00:03.2 IDE interface: Intel Corporation 82Q963/Q965 PT IDER Controller (rev 02) (prog-if 85 [Master SecO PriO])
	Subsystem: Fujitsu Technology Solutions Device 10b5
	Control: I/O+ Mem- BusMaster- SpecCycle- MemWINV- VGASnoop- ParErr- Stepping- SERR- FastB2B- DisINTx-
	Status: Cap+ 66MHz+ UDF- FastB2B+ ParErr- DEVSEL=fast >TAbort- <TAbort- <MAbort- >SERR- <PERR- INTx-
	Interrupt: pin C routed to IRQ 18
	Region 0: I/O ports at 4828 [size=8]
	Region 1: I/O ports at 480c [size=4]
	Region 2: I/O ports at 4820 [size=8]
	Region 3: I/O ports at 4808 [size=4]
	Region 4: I/O ports at 4810 [size=16]
	Capabilities: [c8] Power Management version 3
		Flags: PMEClk- DSI+ D1- D2- AuxCurrent=0mA PME(D0-,D1-,D2-,D3hot-,D3cold-)
		Status: D0 PME-Enable- DSel=0 DScale=0 PME-
	Capabilities: [d0] Message Signalled Interrupts: Mask- 64bit+ Queue=0/0 Enable-
		Address: 0000000000000000  Data: 0000

00:03.3 Serial controller: Intel Corporation 82Q963/Q965 KT Controller (rev 02) (prog-if 02)
	Subsystem: Fujitsu Technology Solutions Device 10b5
	Control: I/O+ Mem+ BusMaster+ SpecCycle- MemWINV- VGASnoop- ParErr- Stepping- SERR- FastB2B- DisINTx-
	Status: Cap+ 66MHz+ UDF- FastB2B+ ParErr- DEVSEL=fast >TAbort- <TAbort- <MAbort- >SERR- <PERR- INTx-
	Latency: 0
	Interrupt: pin B routed to IRQ 17
	Region 0: I/O ports at 4830 [size=8]
	Region 1: Memory at d0124000 (32-bit, non-prefetchable) [size=4K]
	Capabilities: [c8] Power Management version 3
		Flags: PMEClk- DSI+ D1- D2- AuxCurrent=0mA PME(D0-,D1-,D2-,D3hot-,D3cold-)
		Status: D0 PME-Enable- DSel=0 DScale=0 PME-
	Capabilities: [d0] Message Signalled Interrupts: Mask- 64bit+ Queue=0/0 Enable-
		Address: 0000000000000000  Data: 0000
	Kernel driver in use: serial

00:19.0 Ethernet controller: Intel Corporation 82566DM Gigabit Network Connection (rev 02)
	Subsystem: Fujitsu Technology Solutions Device 10b4
	Control: I/O+ Mem+ BusMaster+ SpecCycle- MemWINV- VGASnoop- ParErr- Stepping- SERR+ FastB2B- DisINTx+
	Status: Cap+ 66MHz- UDF- FastB2B- ParErr- DEVSEL=fast >TAbort- <TAbort- <MAbort- >SERR- <PERR- INTx-
	Latency: 0
	Interrupt: pin A routed to IRQ 24
	Region 0: Memory at d0100000 (32-bit, non-prefetchable) [size=128K]
	Region 1: Memory at d0125000 (32-bit, non-prefetchable) [size=4K]
	Region 2: I/O ports at 4840 [size=32]
	Capabilities: [c8] Power Management version 2
		Flags: PMEClk- DSI+ D1- D2- AuxCurrent=0mA PME(D0+,D1-,D2-,D3hot+,D3cold+)
		Status: D0 PME-Enable- DSel=0 DScale=1 PME-
	Capabilities: [d0] Message Signalled Interrupts: Mask- 64bit+ Queue=0/0 Enable+
		Address: 00000000fee0200c  Data: 41a1
	Kernel driver in use: e1000e
	Kernel modules: e1000e

00:1a.0 USB Controller: Intel Corporation 82801H (ICH8 Family) USB UHCI Controller #4 (rev 02)
	Subsystem: Fujitsu Technology Solutions Device 10b6
	Control: I/O+ Mem- BusMaster+ SpecCycle- MemWINV- VGASnoop- ParErr- Stepping- SERR- FastB2B- DisINTx-
	Status: Cap- 66MHz- UDF- FastB2B+ ParErr- DEVSEL=medium >TAbort- <TAbort- <MAbort- >SERR- <PERR- INTx-
	Latency: 0
	Interrupt: pin A routed to IRQ 20
	Region 4: I/O ports at 4860 [size=32]
	Kernel driver in use: uhci_hcd

00:1a.1 USB Controller: Intel Corporation 82801H (ICH8 Family) USB UHCI Controller #5 (rev 02)
	Subsystem: Fujitsu Technology Solutions Device 10b6
	Control: I/O+ Mem- BusMaster+ SpecCycle- MemWINV- VGASnoop- ParErr- Stepping- SERR- FastB2B- DisINTx-
	Status: Cap- 66MHz- UDF- FastB2B+ ParErr- DEVSEL=medium >TAbort- <TAbort- <MAbort- >SERR- <PERR- INTx-
	Latency: 0
	Interrupt: pin B routed to IRQ 18
	Region 4: I/O ports at 4880 [size=32]
	Kernel driver in use: uhci_hcd

00:1a.7 USB Controller: Intel Corporation 82801H (ICH8 Family) USB2 EHCI Controller #2 (rev 02) (prog-if 20)
	Subsystem: Fujitsu Technology Solutions Device 10b6
	Control: I/O- Mem+ BusMaster+ SpecCycle- MemWINV- VGASnoop- ParErr- Stepping- SERR+ FastB2B- DisINTx-
	Status: Cap+ 66MHz- UDF- FastB2B+ ParErr- DEVSEL=medium >TAbort- <TAbort- <MAbort- >SERR- <PERR- INTx-
	Latency: 0
	Interrupt: pin B routed to IRQ 18
	Region 0: Memory at d0326400 (32-bit, non-prefetchable) [size=1K]
	Capabilities: [50] Power Management version 2
		Flags: PMEClk- DSI- D1- D2- AuxCurrent=375mA PME(D0+,D1-,D2-,D3hot+,D3cold+)
		Status: D0 PME-Enable- DSel=0 DScale=0 PME-
	Capabilities: [58] Debug port: BAR=1 offset=00a0
	Kernel driver in use: ehci_hcd

00:1b.0 Audio device: Intel Corporation 82801H (ICH8 Family) HD Audio Controller (rev 02)
	Subsystem: Fujitsu Technology Solutions Device 1083
	Control: I/O- Mem+ BusMaster+ SpecCycle- MemWINV- VGASnoop- ParErr- Stepping- SERR+ FastB2B- DisINTx-
	Status: Cap+ 66MHz- UDF- FastB2B- ParErr- DEVSEL=fast >TAbort- <TAbort- <MAbort- >SERR- <PERR- INTx-
	Latency: 0, Cache Line Size: 32 bytes
	Interrupt: pin A routed to IRQ 20
	Region 0: Memory at d0120000 (64-bit, non-prefetchable) [size=16K]
	Capabilities: [50] Power Management version 2
		Flags: PMEClk- DSI- D1- D2- AuxCurrent=55mA PME(D0+,D1-,D2-,D3hot+,D3cold+)
		Status: D0 PME-Enable- DSel=0 DScale=0 PME-
	Capabilities: [60] Message Signalled Interrupts: Mask- 64bit+ Queue=0/0 Enable-
		Address: 0000000000000000  Data: 0000
	Capabilities: [70] Express (v1) Root Complex Integrated Endpoint, MSI 00
		DevCap:	MaxPayload 128 bytes, PhantFunc 0, Latency L0s <64ns, L1 <1us
			ExtTag- RBE- FLReset-
		DevCtl:	Report errors: Correctable- Non-Fatal- Fatal- Unsupported-
			RlxdOrd- ExtTag- PhantFunc- AuxPwr- NoSnoop+
			MaxPayload 128 bytes, MaxReadReq 128 bytes
		DevSta:	CorrErr- UncorrErr- FatalErr- UnsuppReq- AuxPwr+ TransPend-
		LnkCap:	Port #0, Speed unknown, Width x0, ASPM unknown, Latency L0 <64ns, L1 <1us
			ClockPM- Suprise- LLActRep- BwNot-
		LnkCtl:	ASPM Disabled; Disabled- Retrain- CommClk-
			ExtSynch- ClockPM- AutWidDis- BWInt- AutBWInt-
		LnkSta:	Speed unknown, Width x0, TrErr- Train- SlotClk- DLActive- BWMgmt- ABWMgmt-
	Capabilities: [100] Virtual Channel <?>
	Capabilities: [130] Root Complex Link <?>
	Kernel driver in use: HDA Intel
	Kernel modules: snd-hda-intel

00:1d.0 USB Controller: Intel Corporation 82801H (ICH8 Family) USB UHCI Controller #1 (rev 02)
	Subsystem: Fujitsu Technology Solutions Device 10b6
	Control: I/O+ Mem- BusMaster+ SpecCycle- MemWINV- VGASnoop- ParErr- Stepping- SERR- FastB2B- DisINTx-
	Status: Cap- 66MHz- UDF- FastB2B+ ParErr- DEVSEL=medium >TAbort- <TAbort- <MAbort- >SERR- <PERR- INTx-
	Latency: 0
	Interrupt: pin A routed to IRQ 23
	Region 4: I/O ports at 48a0 [size=32]
	Kernel driver in use: uhci_hcd

00:1d.1 USB Controller: Intel Corporation 82801H (ICH8 Family) USB UHCI Controller #2 (rev 02)
	Subsystem: Fujitsu Technology Solutions Device 10b6
	Control: I/O+ Mem- BusMaster+ SpecCycle- MemWINV- VGASnoop- ParErr- Stepping- SERR- FastB2B- DisINTx-
	Status: Cap- 66MHz- UDF- FastB2B+ ParErr- DEVSEL=medium >TAbort- <TAbort- <MAbort- >SERR- <PERR- INTx-
	Latency: 0
	Interrupt: pin B routed to IRQ 22
	Region 4: I/O ports at 48c0 [size=32]
	Kernel driver in use: uhci_hcd

00:1d.2 USB Controller: Intel Corporation 82801H (ICH8 Family) USB UHCI Controller #3 (rev 02)
	Subsystem: Fujitsu Technology Solutions Device 10b6
	Control: I/O+ Mem- BusMaster+ SpecCycle- MemWINV- VGASnoop- ParErr- Stepping- SERR- FastB2B- DisINTx-
	Status: Cap- 66MHz- UDF- FastB2B+ ParErr- DEVSEL=medium >TAbort- <TAbort- <MAbort- >SERR- <PERR- INTx-
	Latency: 0
	Interrupt: pin C routed to IRQ 21
	Region 4: I/O ports at 48e0 [size=32]
	Kernel driver in use: uhci_hcd

00:1d.7 USB Controller: Intel Corporation 82801H (ICH8 Family) USB2 EHCI Controller #1 (rev 02) (prog-if 20)
	Subsystem: Fujitsu Technology Solutions Device 10b6
	Control: I/O- Mem+ BusMaster+ SpecCycle- MemWINV- VGASnoop- ParErr- Stepping- SERR+ FastB2B- DisINTx-
	Status: Cap+ 66MHz- UDF- FastB2B+ ParErr- DEVSEL=medium >TAbort- <TAbort- <MAbort- >SERR- <PERR- INTx-
	Latency: 0
	Interrupt: pin A routed to IRQ 23
	Region 0: Memory at d0326800 (32-bit, non-prefetchable) [size=1K]
	Capabilities: [50] Power Management version 2
		Flags: PMEClk- DSI- D1- D2- AuxCurrent=375mA PME(D0+,D1-,D2-,D3hot+,D3cold+)
		Status: D0 PME-Enable- DSel=0 DScale=0 PME-
	Capabilities: [58] Debug port: BAR=1 offset=00a0
	Kernel driver in use: ehci_hcd

00:1e.0 PCI bridge: Intel Corporation 82801 PCI Bridge (rev f2) (prog-if 01)
	Control: I/O+ Mem+ BusMaster+ SpecCycle- MemWINV- VGASnoop- ParErr- Stepping- SERR+ FastB2B- DisINTx-
	Status: Cap+ 66MHz- UDF- FastB2B- ParErr- DEVSEL=fast >TAbort- <TAbort- <MAbort- >SERR- <PERR- INTx-
	Latency: 0
	Bus: primary=00, secondary=18, subordinate=18, sec-latency=32
	I/O behind bridge: 0000f000-00000fff
	Memory behind bridge: fff00000-000fffff
	Prefetchable memory behind bridge: 00000000fff00000-00000000000fffff
	Secondary status: 66MHz- FastB2B+ ParErr- DEVSEL=medium >TAbort- <TAbort- <MAbort+ <SERR- <PERR-
	BridgeCtl: Parity- SERR- NoISA+ VGA- MAbort- >Reset- FastB2B-
		PriDiscTmr- SecDiscTmr- DiscTmrStat- DiscTmrSERREn-
	Capabilities: [50] Subsystem: Fujitsu Technology Solutions Device 10b6

00:1f.0 ISA bridge: Intel Corporation 82801HO (ICH8DO) LPC Interface Controller (rev 02)
	Subsystem: Fujitsu Technology Solutions Device 10b6
	Control: I/O+ Mem+ BusMaster+ SpecCycle- MemWINV- VGASnoop- ParErr- Stepping- SERR- FastB2B- DisINTx-
	Status: Cap+ 66MHz- UDF- FastB2B- ParErr- DEVSEL=medium >TAbort- <TAbort- <MAbort- >SERR- <PERR- INTx-
	Latency: 0
	Capabilities: [e0] Vendor Specific Information <?>
	Kernel modules: iTCO_wdt

00:1f.2 IDE interface: Intel Corporation 82801H (ICH8 Family) 4 port SATA IDE Controller (rev 02) (prog-if 8a [Master SecP PriP])
	Subsystem: Fujitsu Technology Solutions Device 10b6
	Control: I/O+ Mem+ BusMaster+ SpecCycle- MemWINV- VGASnoop- ParErr- Stepping- SERR- FastB2B- DisINTx-
	Status: Cap+ 66MHz+ UDF- FastB2B+ ParErr- DEVSEL=medium >TAbort- <TAbort- <MAbort- >SERR- <PERR- INTx-
	Latency: 0
	Interrupt: pin B routed to IRQ 19
	Region 0: I/O ports at 01f0 [size=8]
	Region 1: I/O ports at 03f4 [size=1]
	Region 2: I/O ports at 0170 [size=8]
	Region 3: I/O ports at 0374 [size=1]
	Region 4: I/O ports at 4c10 [size=16]
	Region 5: I/O ports at 4c00 [size=16]
	Capabilities: [70] Power Management version 3
		Flags: PMEClk- DSI- D1- D2- AuxCurrent=0mA PME(D0-,D1-,D2-,D3hot+,D3cold-)
		Status: D0 PME-Enable- DSel=0 DScale=0 PME-
	Kernel driver in use: ata_piix

00:1f.3 SMBus: Intel Corporation 82801H (ICH8 Family) SMBus Controller (rev 02)
	Subsystem: Fujitsu Technology Solutions Device 10b6
	Control: I/O+ Mem- BusMaster- SpecCycle- MemWINV- VGASnoop- ParErr- Stepping- SERR- FastB2B- DisINTx-
	Status: Cap- 66MHz- UDF- FastB2B+ ParErr- DEVSEL=medium >TAbort- <TAbort- <MAbort- >SERR- <PERR- INTx-
	Interrupt: pin B routed to IRQ 11
	Region 0: Memory at d0326c00 (32-bit, non-prefetchable) [disabled] [size=256]
	Region 4: I/O ports at 4c40 [size=32]
	Kernel modules: i2c-i801

00:1f.5 IDE interface: Intel Corporation 82801H (ICH8 Family) 2 port SATA IDE Controller (rev 02) (prog-if 85 [Master SecO PriO])
	Subsystem: Fujitsu Technology Solutions Device 10b6
	Control: I/O+ Mem- BusMaster+ SpecCycle- MemWINV- VGASnoop- ParErr- Stepping- SERR- FastB2B- DisINTx-
	Status: Cap+ 66MHz+ UDF- FastB2B+ ParErr- DEVSEL=medium >TAbort- <TAbort- <MAbort- >SERR- <PERR- INTx-
	Latency: 0
	Interrupt: pin C routed to IRQ 22
	Region 0: I/O ports at 4c80 [size=8]
	Region 1: I/O ports at 4c74 [size=4]
	Region 2: I/O ports at 4c78 [size=8]
	Region 3: I/O ports at 4c70 [size=4]
	Region 4: I/O ports at 4c60 [size=16]
	Region 5: I/O ports at 4c30 [size=16]
	Capabilities: [70] Power Management version 3
		Flags: PMEClk- DSI- D1- D2- AuxCurrent=0mA PME(D0-,D1-,D2-,D3hot+,D3cold-)
		Status: D0 PME-Enable- DSel=0 DScale=0 PME-
	Kernel driver in use: ata_piix

